{
  "$schema": "https://json-schema.org/draft/2020-12/schema",
  "$id": "tilsoftai://contracts/models.attributes.list.v2",
  "title": "models.attributes.list.v2",
  "description": "Stable payload contract for models.attributes.list returning TabularData name/value pairs. ToolInvoker wraps this in tilsoft.envelope.v1.",
  "type": "object",
  "additionalProperties": false,
  "required": [
    "kind",
    "schemaVersion",
    "generatedAtUtc",
    "resource",
    "data",
    "warnings"
  ],
  "properties": {
    "kind": {
      "type": "string",
      "const": "models.attributes.list.v2"
    },
    "schemaVersion": {
      "type": "integer",
      "const": 2
    },
    "generatedAtUtc": {
      "type": "string",
      "format": "date-time"
    },
    "resource": {
      "type": "string",
      "const": "models.attributes.list"
    },
    "data": {
      "type": "object",
      "additionalProperties": false,
      "required": [
        "modelId",
        "table"
      ],
      "properties": {
        "modelId": {
          "type": "string",
          "format": "uuid"
        },
        "table": {
          "$ref": "tabular.data.v1.schema.json"
        }
      }
    },
    "warnings": {
      "type": "array",
      "items": {
        "type": "string"
      }
    }
  }
}
